{
  "$schema": "https://json-schema.org/draft/2020-12/schema",
  "$id": "https://openvaluesstandard.org/schema/format-registry-v1.schema.json",
  "title": "Open Values Format Registry",
  "description": "The list of every Open Values file format, one entry each: what the format is for, where its schema is, which files and code write it, which code reads it, and which checks enforce it. The project keeps it by hand at app/data/standard/registry.json; the standard audit and the spec pages on openvaluesstandard.org read it.",
  "type": "object",
  "additionalProperties": false,
  "required": [
    "format",
    "version",
    "standard",
    "standardVersion",
    "updated",
    "entries"
  ],
  "properties": {
    "format": {
      "description": "Always \"open-values-format-registry\". Tells a reader which Open Values format this is.",
      "const": "open-values-format-registry"
    },
    "version": {
      "description": "The version of the registry format this file follows, as a semantic version such as \"0.1.0\".",
      "$ref": "#/$defs/semver"
    },
    "standard": {
      "description": "Always \"open-values-standard\", the standard this registry belongs to.",
      "const": "open-values-standard"
    },
    "standardVersion": {
      "description": "The version of the Open Values Standard the registry describes, as a semantic version such as \"1.0.0-draft.1\".",
      "$ref": "#/$defs/semver"
    },
    "updated": {
      "description": "The date the registry was last changed, as YYYY-MM-DD.",
      "type": "string",
      "pattern": "^\\d{4}-\\d{2}-\\d{2}$"
    },
    "entries": {
      "description": "One entry per file format. At least one.",
      "type": "array",
      "minItems": 1,
      "items": {
        "$ref": "#/$defs/entry"
      }
    }
  },
  "$defs": {
    "semver": {
      "type": "string",
      "pattern": "^(0|[1-9]\\d*)\\.(0|[1-9]\\d*)\\.(0|[1-9]\\d*)(?:-[0-9A-Za-z.-]+)?(?:\\+[0-9A-Za-z.-]+)?$"
    },
    "path": {
      "type": "string",
      "minLength": 1
    },
    "pathList": {
      "type": "array",
      "items": {
        "$ref": "#/$defs/path"
      },
      "uniqueItems": true
    },
    "marker": {
      "type": "object",
      "additionalProperties": false,
      "required": [
        "mode"
      ],
      "properties": {
        "mode": {
          "description": "How the standard audit recognises a file of this format: \"explicit-format\" (the file names its format in a format field), \"legacy-shape\" (older files with no format field, recognised by their path and shape), \"schema\" (the format is a schema used inside other formats, not a file of its own), \"html-jsonld\" (a JSON-LD block inside an HTML page), or \"test-fixture\".",
          "enum": [
            "explicit-format",
            "legacy-shape",
            "schema",
            "html-jsonld",
            "test-fixture"
          ]
        },
        "format": {
          "description": "For explicit-format files, the value the file's format field must hold, such as \"open-values-lens\".",
          "type": "string",
          "pattern": "^(open-values|ovs)-[a-z0-9]+(?:-[a-z0-9]+)*$"
        },
        "pathPattern": {
          "description": "Where files of this format live in the repository, as a path that may use \"*\", such as \"content/lenses/*.json\".",
          "$ref": "#/$defs/path"
        },
        "pathPatterns": {
          "description": "Several such paths, when files of this format live in more than one place. No path may repeat.",
          "$ref": "#/$defs/pathList"
        },
        "field": {
          "type": "string",
          "minLength": 1
        },
        "value": {
          "type": [
            "string",
            "number",
            "boolean"
          ]
        },
        "notes": {
          "description": "A sentence on how files of this format are recognised, when the mode alone does not say, such as \"Existing lenses are identified by path plus meta/criteria/products shape.\"",
          "type": "string"
        }
      }
    },
    "compatibility": {
      "type": "object",
      "additionalProperties": false,
      "properties": {
        "acceptsLegacyVersion": {
          "description": "True when older files of this format, written before the current version rules, are still accepted. The notes field says what is accepted.",
          "type": "boolean"
        },
        "acceptsBareVersion": {
          "description": "True when files may declare a short version such as \"0.1\" instead of a full semantic version. The standard audit requires this for any entry whose declaredVersion is a short version.",
          "type": "boolean"
        },
        "breakingChangePolicy": {
          "description": "A sentence on how a change that breaks existing files would be handled. No entry uses it yet.",
          "type": "string"
        },
        "migration": {
          "description": "A sentence on how to move older files to the current version. No entry uses it yet.",
          "type": "string"
        },
        "notes": {
          "description": "A sentence on what older or unusual files remain valid, such as \"Sparse map scores and explicit null unknowns remain valid.\"",
          "type": "string"
        }
      }
    },
    "entry": {
      "type": "object",
      "additionalProperties": false,
      "required": [
        "id",
        "version",
        "status",
        "kind",
        "purpose",
        "marker",
        "schema",
        "sourceOfTruth",
        "generatedOutputs",
        "builders",
        "audits",
        "ownerLane",
        "runtimeConsumers",
        "compatibility"
      ],
      "properties": {
        "id": {
          "description": "The format's name, such as \"open-values-lens\". Files of explicit-format formats carry it in their format field.",
          "type": "string",
          "pattern": "^(open-values|ovs)-[a-z0-9]+(?:-[a-z0-9]+)*$"
        },
        "version": {
          "description": "The current version of the format, as a semantic version such as \"0.1.0\".",
          "$ref": "#/$defs/semver"
        },
        "declaredVersion": {
          "description": "The version string files of this format actually carry, which may differ from version: a short version such as \"0.1\" (allowed only with acceptsBareVersion), or \"none\" for legacy-shape files that carry no version.",
          "type": "string"
        },
        "status": {
          "description": "How settled the format is: stable (a breaking change needs a new version), draft (may still change), experimental, dev-contract (used while building the sites, not meant for other apps), or legacy.",
          "enum": [
            "stable",
            "draft",
            "experimental",
            "dev-contract",
            "legacy"
          ]
        },
        "kind": {
          "description": "What sort of file it is: source (someone writes and keeps it), generated (a build step makes it from other files), fixture (test data), distribution (published for others to download), or internal (a shape used inside other formats, not a file on its own).",
          "enum": [
            "source",
            "generated",
            "fixture",
            "distribution",
            "internal"
          ]
        },
        "purpose": {
          "description": "One sentence saying what the format is for.",
          "type": "string",
          "minLength": 1
        },
        "marker": {
          "description": "How the standard audit finds and recognises files of this format.",
          "$ref": "#/$defs/marker"
        },
        "schema": {
          "description": "The repository path of the format's JSON Schema, such as \"app/data/standard/schemas/lens.schema.json\", or null when there is none.",
          "type": [
            "string",
            "null"
          ]
        },
        "schemaNote": {
          "description": "Why the format has no schema, or what checks the schema leaves to an audit. Required when schema is null.",
          "type": "string"
        },
        "sourceOfTruth": {
          "description": "The files that define the format or hold its authored data, such as docs or the hand-edited source file.",
          "$ref": "#/$defs/pathList"
        },
        "generatedOutputs": {
          "description": "The files a build step makes from this format, if any.",
          "$ref": "#/$defs/pathList"
        },
        "builders": {
          "description": "The scripts that write files of this format, such as \"pipeline/build_map.js\".",
          "$ref": "#/$defs/pathList"
        },
        "audits": {
          "description": "The commands or scripts that check files of this format, such as \"npm run audit:standard\".",
          "type": "array",
          "items": {
            "type": "string",
            "minLength": 1
          },
          "uniqueItems": true
        },
        "ownerLane": {
          "description": "Who maintains the format: data-lane (the data and pipeline work), app-lane (hand-edited app code), generated (only ever written by a builder), external (defined outside this repository), or shared.",
          "enum": [
            "data-lane",
            "app-lane",
            "generated",
            "external",
            "shared"
          ]
        },
        "runtimeConsumers": {
          "description": "The code or pages that read files of this format, such as \"app/homelens.js\", or a short name for a planned reader.",
          "type": "array",
          "items": {
            "type": "string",
            "minLength": 1
          },
          "uniqueItems": true
        },
        "compatibility": {
          "description": "Which older or unusual files of this format are still accepted.",
          "$ref": "#/$defs/compatibility"
        },
        "dependencies": {
          "description": "The ids of other formats this one is built from, such as \"open-values-source\". Each must be an id in this registry.",
          "type": "array",
          "items": {
            "type": "string",
            "pattern": "^(open-values|ovs)-[a-z0-9]+(?:-[a-z0-9]+)*$"
          },
          "uniqueItems": true
        },
        "formerNames": {
          "type": "array",
          "items": {
            "type": "string",
            "minLength": 1
          },
          "uniqueItems": true,
          "description": "Names this format was published under before, which a reader treats as the same format. For example, the Hearth's position file was briefly named hearth-position."
        }
      }
    }
  }
}
