{
  "format": "open-values-format-registry",
  "version": "0.1.0",
  "standard": "open-values-standard",
  "standardVersion": "1.0.0-draft.1",
  "updated": "2026-09-23",
  "entries": [
    {
      "id": "open-values-format-registry",
      "version": "0.1.0",
      "declaredVersion": "0.1.0",
      "status": "draft",
      "kind": "source",
      "purpose": "Machine-readable registry of Open Values file formats, schemas, builders, audits, and ownership lanes.",
      "marker": {
        "mode": "explicit-format",
        "format": "open-values-format-registry",
        "pathPattern": "app/data/standard/registry.json"
      },
      "schema": "app/data/standard/schemas/format-registry.schema.json",
      "sourceOfTruth": [
        "docs/STANDARD-v1.md",
        "docs/STANDARD-v1-REGISTRY-INVENTORY.md",
        "app/data/standard/registry.json"
      ],
      "generatedOutputs": [
        "app/data/challenge-index.json"
      ],
      "builders": [
        "pipeline/build_challenge.js"
      ],
      "audits": [
        "npm run audit:standard"
      ],
      "ownerLane": "data-lane",
      "runtimeConsumers": [
        "audit:standard",
        "standard documentation"
      ],
      "compatibility": {
        "acceptsLegacyVersion": false,
        "notes": "This registry begins in v1 draft and has no legacy file."
      }
    },
    {
      "id": "open-values-conformance-vectors",
      "version": "0.1.0",
      "declaredVersion": "0.1.0",
      "status": "draft",
      "kind": "fixture",
      "purpose": "Known-good and known-bad examples for Standard v1 audit checks.",
      "marker": {
        "mode": "explicit-format",
        "format": "open-values-conformance-vectors",
        "pathPattern": "app/data/standard/conformance-vectors.json"
      },
      "schema": "app/data/standard/schemas/conformance-vectors.schema.json",
      "sourceOfTruth": [
        "app/data/standard/conformance-vectors.json",
        "docs/STANDARD-v1.md"
      ],
      "generatedOutputs": [
        "app/data/asks-offers-index.json"
      ],
      "builders": [
        "pipeline/build_initiatives.js"
      ],
      "audits": [
        "npm run audit:standard"
      ],
      "ownerLane": "data-lane",
      "runtimeConsumers": [
        "audit:standard",
        "future implementer test suites"
      ],
      "compatibility": {
        "acceptsLegacyVersion": false,
        "notes": "This vector set begins in v1 draft and has no legacy file."
      }
    },
    {
      "id": "open-values-source",
      "version": "0.1.0",
      "declaredVersion": "0.1.0",
      "status": "stable",
      "kind": "internal",
      "purpose": "Reusable provenance value schema for notes and citation objects.",
      "marker": {
        "mode": "schema",
        "pathPattern": "app/data/standard/schemas/source.schema.json"
      },
      "schema": "app/data/standard/schemas/source.schema.json",
      "sourceOfTruth": [
        "docs/STANDARD-v1.md",
        "app/data/standard/schemas/source.schema.json"
      ],
      "generatedOutputs": [],
      "builders": [],
      "audits": [
        "npm run audit:standard"
      ],
      "ownerLane": "shared",
      "runtimeConsumers": [
        "open-values-entity",
        "open-values-rating",
        "open-values-lens"
      ],
      "compatibility": {
        "acceptsLegacyVersion": true,
        "notes": "Legacy plain-string provenance remains valid; citation objects are preferred for assessed claims."
      }
    },
    {
      "id": "open-values-criterion",
      "version": "0.1.0",
      "declaredVersion": "0.1.0",
      "status": "stable",
      "kind": "internal",
      "purpose": "Reusable criterion schema for scoring axes within lenses and category indexes.",
      "marker": {
        "mode": "schema",
        "pathPattern": "app/data/standard/schemas/criterion.schema.json"
      },
      "schema": "app/data/standard/schemas/criterion.schema.json",
      "sourceOfTruth": [
        "docs/STANDARD-v1.md",
        "app/data/standard/schemas/criterion.schema.json"
      ],
      "generatedOutputs": [],
      "builders": [],
      "audits": [
        "npm run audit:standard"
      ],
      "ownerLane": "shared",
      "runtimeConsumers": [
        "open-values-lens",
        "open-values-category-index"
      ],
      "compatibility": {
        "acceptsLegacyVersion": true,
        "notes": "Current criteria already match this shape."
      }
    },
    {
      "id": "open-values-rating",
      "version": "0.1.0",
      "declaredVersion": "0.1.0",
      "status": "stable",
      "kind": "internal",
      "purpose": "Reusable score-value and expanded rating schema.",
      "marker": {
        "mode": "schema",
        "pathPattern": "app/data/standard/schemas/rating.schema.json"
      },
      "schema": "app/data/standard/schemas/rating.schema.json",
      "sourceOfTruth": [
        "docs/STANDARD-v1.md",
        "app/data/standard/schemas/rating.schema.json"
      ],
      "generatedOutputs": [],
      "builders": [],
      "audits": [
        "npm run audit:standard"
      ],
      "ownerLane": "shared",
      "runtimeConsumers": [
        "open-values-entity",
        "open-values-lens"
      ],
      "compatibility": {
        "acceptsLegacyVersion": true,
        "notes": "Sparse map scores and explicit null unknowns remain valid."
      },
      "dependencies": [
        "open-values-source"
      ]
    },
    {
      "id": "open-values-entity",
      "version": "0.1.0",
      "declaredVersion": "0.1.0",
      "status": "stable",
      "kind": "internal",
      "purpose": "Reusable entity schema for products, services, media, organizations, and initiatives inside lenses.",
      "marker": {
        "mode": "schema",
        "pathPattern": "app/data/standard/schemas/entity.schema.json"
      },
      "schema": "app/data/standard/schemas/entity.schema.json",
      "sourceOfTruth": [
        "docs/STANDARD-v1.md",
        "app/data/standard/schemas/entity.schema.json"
      ],
      "generatedOutputs": [],
      "builders": [],
      "audits": [
        "npm run audit:standard"
      ],
      "ownerLane": "shared",
      "runtimeConsumers": [
        "open-values-lens",
        "open-values-category-dataset"
      ],
      "compatibility": {
        "acceptsLegacyVersion": true,
        "notes": "Consumers must ignore unknown entity extension fields."
      },
      "dependencies": [
        "open-values-rating",
        "open-values-source"
      ]
    },
    {
      "id": "open-values-lens",
      "version": "0.1.0",
      "declaredVersion": "none",
      "status": "stable",
      "kind": "source",
      "purpose": "A domain-specific set of criteria and ranked entities with sparse scores and provenance.",
      "marker": {
        "mode": "legacy-shape",
        "pathPattern": "content/lenses/*.json",
        "notes": "Existing lenses are identified by path plus meta/criteria/products shape."
      },
      "schema": "app/data/standard/schemas/lens.schema.json",
      "sourceOfTruth": [
        "content/lenses/*.json"
      ],
      "generatedOutputs": [
        "app/data/<cid>.json",
        "app/data.js"
      ],
      "builders": [
        "pipeline/build_datasets.py"
      ],
      "audits": [
        "npm run audit:conformance",
        "node research/verify_run.js"
      ],
      "ownerLane": "data-lane",
      "runtimeConsumers": [
        "app data loader",
        "app/engine.js",
        "verdict cards",
        "node indexes"
      ],
      "compatibility": {
        "acceptsLegacyVersion": true,
        "notes": "Root format/version fields are not required for existing lenses during v1 draft."
      },
      "dependencies": [
        "open-values-criterion",
        "open-values-entity"
      ]
    },
    {
      "id": "open-values-decision-contracts",
      "version": "0.2.0",
      "declaredVersion": "0.2.0",
      "status": "draft",
      "kind": "source",
      "purpose": "Signed differences reads, practical category axes, budget-data posture, and applicable computed-answer slots for decision pages.",
      "marker": {
        "mode": "explicit-format",
        "format": "open-values-decision-contracts",
        "pathPattern": "content/decisions.json"
      },
      "schema": "app/data/standard/schemas/decision-contracts.schema.json",
      "schemaNote": "The schema guards the portable shape; research/two_fields_audit.js resolves categories, verifies populated criterion spreads, and checks generated dataset/index parity.",
      "sourceOfTruth": [
        "content/decisions.json"
      ],
      "generatedOutputs": [
        "app/data/<cid>.json meta.decision",
        "app/data/index.json categories[].decision",
        "app/data.js"
      ],
      "builders": [
        "pipeline/build_datasets.py"
      ],
      "audits": [
        "node research/two_fields_audit.js",
        "node research/decision_rollout_audit.js",
        "npm run audit:standard"
      ],
      "ownerLane": "data-lane",
      "runtimeConsumers": [
        "Round 4 decision-page header",
        "Round 4 practical dials",
        "Round 4 computed answer recipes",
        "Round 6 shared-floor interface",
        "Round 9 category-wide decision-page rollout"
      ],
      "compatibility": {
        "acceptsLegacyVersion": false,
        "notes": "The contract is semver-native; founder-approved preserves the bounded Round 5 pilot baseline and records the Round 9 batch rollout."
      },
      "dependencies": [
        "open-values-criterion"
      ]
    },
    {
      "id": "open-values-category-dataset",
      "version": "0.1.0",
      "declaredVersion": "none",
      "status": "stable",
      "kind": "generated",
      "purpose": "Built app-ready category data, including curated and open-data product/service datasets.",
      "marker": {
        "mode": "legacy-shape",
        "pathPattern": "app/data/<cid>.json",